{
  "name": "newapi-responses-tool-chain-preserved",
  "request_shape": "responses",
  "required_guards": ["explicit_mutation_only", "preserve_responses_tool_chain", "redacted_trace"],
  "adapter": {
    "version": "0.2",
    "adapter": "newapi",
    "hooks": ["responses.before_upstream"],
    "actions": ["context.truncate"],
    "request_shapes": ["responses"],
    "guards": ["explicit_mutation_only", "preserve_responses_tool_chain", "redacted_trace"]
  },
  "policy": {
    "version": "0.2",
    "programs": [
      {
        "name": "preserve-responses-tool-chain",
        "models": ["*"],
        "steps": [
          {
            "hook": "responses.before_upstream",
            "do": [
              {
                "action": "context.truncate",
                "keep_last_messages": 1,
                "preserve_roles": ["system"]
              }
            ]
          }
        ]
      }
    ]
  },
  "request": {
    "model": "gpt-5.4-mini",
    "previous_response_id": "resp_1",
    "input": [
      {
        "type": "item_reference",
        "id": "fc_1"
      },
      {
        "type": "function_call_output",
        "call_id": "call_1",
        "output": "{\"ok\":true}"
      },
      {
        "role": "user",
        "content": "continue"
      }
    ]
  }
}
